order_id,customer_id,date,nearest_warehouse,shopping_cart,order_price,delivery_charges,customer_lat,customer_long,coupon_discount,order_total,season,is_expedited_delivery,distance_to_nearest_warehouse,latest_customer_review,is_happy_customer
ORD331241,ID0780992532,2019-06-25,Thompson,"[('iStream', 1), ('Lucent 330S', 1)]",1380.0,78.96,-37.8056197,144.95376069999998,10,1320.96,Winter,True,0.9813,perfect for the money nice and great cellphone,1.0
ORD495860,ID1462399059,2019-11-08,,"[('Alcon 10', 1), ('iAssist Line', 2), ('pearTV', 2)]",26020.0,113.08,-37.8200279,145.015796,25,19628.08,Spring,True,2.1254,five stars outstanding in every way.,1.0
ORD040934,ID2975216740,2019-06-24,Thompson,"[('Olivia x460', 1), ('Candle Inferno', 2)]",2085.0,70.64,-37.7993462,144.95926819999997,5,2051.39,Winter,False,1.8309,all real aasi spect i love everything about it .,1.0
ORD006716,ID6167266624,2019-01-24,,"[('Toshika 750', 1), ('iAssist Line', 2), ('Candle Inferno', 1)]",9200.0,95.92,-37.80962279999999,144.9636872,5,8835.92,Summer,True,1.124,"so good like description, work perfeclty on windows os",1.0
ORD300007,ID1463547022,2019-05-11,Bakers,"[('Candle Inferno', 2), ('Toshika 750', 1), ('iAssist Line', 1), ('Lucent 330S', 2)]",9865.0,80.5,-37.81897100000001,145.0038358,5,9452.25,Autumn,True,1.2532,five stars works very well thank you,
ORD021229,ID1277988777,2019-10-15,Bakers,"[('Universe Note', 1), ('Candle Inferno', 2)]",4310.0,65.56,-37.8132128,145.0108971,15,3729.06,Spring,False,1.4234,"dont waste your time this phone is pure crap. it is supeeeer slow it laggs soo much, cant do two things at the same time, because phone freezes everything . i will be returning this phone",0.0
ORD047919,ID0370243860,2019-06-08,Nickolson,"[('iStream', 2), ('Toshika 750', 1), ('pearTV', 2), ('iAssist Line', 2)]",21690.0,68.29,-37.8012518,144.9684763,0,21758.29,Winter,True,1.9329,wasn't able to use. was not able to turn item on because item either had a previous balance or was not unlocked. requested a refund.,0.0
ORD278004,ID3215191996,2019-09-02,Thompson,"[('Thunder line', 1), ('iAssist Line', 1), ('Toshika 750', 1), ('Olivia x460', 2)]",11175.0,,-37.8061201,144.9486771,25,8481.69,Spring,True,0.7431,"maginifico equipo llego en 10 dias super rapido, totalmente nuevo y desbloqueado para todas las compañias, es super super bueno,, lo recomiendo, es de uso personal y es super genial!",1.0
ORD473473,ID0591233422,2019-09-30,Thompson,"[('iStream', 2), ('pearTV', 1)]",6610.0,79.94,-37.8244413,144.9526875,15,5698.44,Spring,False,1.4001,awesome looks brand new to me very happy,1.0
ORD477729,ID3212024918,2019-11-30,,"[('Thunder line', 2), ('Lucent 330S', 2), ('Universe Note', 1), ('iStream', 1)]",10420.0,83.24,-37.8082598,144.94816509999995,0,10503.24,Spring,True,,said it was new and it is not!! this phone said it was new when i ordered it. i however is not new. it has chips in it on the corners of it. i'm not happy at all with this phone!!,0.0
ORD274868,ID1560149567,2019-04-15,Thompson,"[('Universe Note', 1), ('Thunder line', 2)]",7810.0,64.74,-37.8159139,144.9381486,10,7093.74,Autumn,False,0.8634,"lo amo ❤ simplemente es perfecto, llegó super bien empaquetado, en perfecto estado y estoy super enamorada de este teléfono ❤️ lo recomiendo al máximo!!!",1.0
ORD243775,ID6273358850,2019-05-17,Thompson,"[('Toshika 750', 1), ('Thunder line', 1)]",6500.0,71.39,-37.799531,144.9621939,25,4946.39,Autumn,False,1.9773,great value for such a well made tablet. everything you need for a low price,1.0
ORD053489,ID2174950856,2019-12-24,,"[('Thunder line', 2), ('iStream', 2), ('Universe Note', 2)]",11560.0,91.57,-37.8171865,144.9532135,5,11073.57,Summer,True,,nice and wonderful xp phone its just the perfect phone for the xp lovers. the phone texture is of high quality and comes with accessories,1.0
ORD452696,ID0373643807,2019-06-03,Thompson,"[('Olivia x460', 2), ('Candle Inferno', 2), ('iAssist Line', 2)]",7760.0,83.98,-37.8086589,144.9259279,25,5903.98,Winter,True,1.9122,five stars love the phone and it's speedy and takes photos of great quality.,1.0
ORD469788,ID0252587670,2019-02-02,Nickolson,"[('iAssist Line', 2), ('iStream', 1), ('Toshika 750', 1)]",8920.0,81.7,-37.8242838,144.98681499999995,5,8555.7,Summer,False,1.6448,"king of the mid range phones great design, super fast and unbeatable price. really happy i bought it.",1.0
ORD243774,ID0370285607,2019-07-31,Thompson,"[('iStream', 2), ('pearTV', 2)]",12920.0,49.43,-37.8149517,144.9574841,15,11031.43,Winter,False,0.9504,artículo robado y vendido como repontenciado actualmente la operadora local en argentina bloqueo el funcionamiento de este artículo por tratarse de ser robado,0.0
ORD017516,ID0775945934,2019-02-16,Thompson,"[('Alcon 10', 1), ('Universe Note', 1), ('Lucent 330S', 2)]",14860.0,76.84,-37.8056895,144.95924019999995,0,14936.84,Summer,False,1.3229,great.. great.... got what i wanted for a good price. simple as that. wish all purchases could be that way.,1.0
ORD275579,ID6167359485,2019-03-10,Nickolson,"[('pearTV', 2), ('Alcon 10', 1)]",,50.12,-37.812877,144.9740492,5,,Autumn,False,0.7494,didn't do the job it was not listed as a prepaid phone. couldn't activate it at verizon. i wound up having to purchase another phone anyway and couldn't return it.,0.0
ORD249625,ID3153810249,2019-01-27,Nickolson,"[('iAssist Line', 1), ('Universe Note', 1), ('Candle Inferno', 2)]",6535.0,97.7,-37.80892470000001,144.96168390000003,5,6305.95,Summer,True,1.2796,five stars in an age of smart phones it's nice to be able to get a good quality flipper,1.0
ORD362249,ID0260907255,2019-12-09,,"[('pearTV', 1), ('Toshika 750', 2), ('Candle Inferno', 1), ('Lucent 330S', 1)]",16610.0,104.49,-37.8247719,145.0073524,10,15053.49,Summer,True,,excellent value an excellent phone like new. a bargain at the price.,1.0
ORD244890,ID1880686094,2019-05-16,Thompson,"[('iAssist Line', 2), ('iStream', 1), ('Thunder line', 2), ('Candle Inferno', 1)]",9390.0,66.56,-37.8026378,144.94546259999996,5,8987.06,Autumn,False,1.126,this is a great value product and is (for me) an equal to an ipad.,1.0
ORD225287,ID0595594352,2019-09-20,Nickolson,"[('Alcon 10', 1), ('Olivia x460', 1), ('iStream', 2)]",10475.0,87.16,-37.810906,144.9671561,5,10038.41,Spring,True,0.8814,run the phone was reported stolen and could not use. big issue and headache trying to get all our money back.,0.0
ORD427591,ID0248746964,2019-09-28,Bakers,"[('pearTV', 1), ('iAssist Line', 2), ('Olivia x460', 1)]",11985.0,77.4,-37.8183757,144.9971149,10,10863.9,Spring,False,0.9474,"nice phone excellent phone for the price , i use it in simple mobile and the red is excellent. else all the the phone is magnific. good buy.",1.0
ORD202688,ID5656845890,2019-09-27,Bakers,"[('iAssist Line', 2), ('Toshika 750', 1), ('pearTV', 2), ('Candle Inferno', 2)]",22250.0,80.23,-37.81761510000001,145.00541069999997,5,21217.73,Spring,False,1.2331,best buy/awesome phone one of the best prepaid phones ever!,1.0
ORD154524,ID2005895253,2019-12-04,Nickolson,"[('Lucent 330S', 2), ('Thunder line', 1), ('Alcon 10', 1)]",13590.0,83.35,-37.8020981,144.9657009,15,11634.85,Summer,False,1.8673,"a happy customer just received my used lucent g. very fast and smooth. i am currently using alcon 4s but lucent g is way faster. the other good news is, i was able to activate it on tracfone.",1.0
ORD093286,ID2384091378,2019-12-04,Nickolson,"[('iStream', 2), ('iAssist Line', 1), ('Olivia x460', 1), ('Universe Note', 1)]",7200.0,97.32,-37.8078707,144.9730414,10,6577.32,Summer,True,1.2326,love the phone - arrived on time i really love the phone and that i got to choose 1 day shipping - very happy!,1.0
ORD057416,ID0299023529,2019-02-08,Bakers,"[('Alcon 10', 2), ('Olivia x460', 2), ('iStream', 2), ('Universe Note', 1)]",24100.0,73.12,-37.807004600000006,145.0037858,0,24173.12,Summer,False,0.8227,great looking it was for my mom who lost her note 6 and wanted something similar!! she says she loves it and it’s like brand new,1.0
ORD221988,ID0131247270,2019-07-18,Nickolson,"[('Toshika 750', 2), ('Alcon 10', 2), ('Olivia x460', 2)]",28990.0,76.53,-37.8129752,144.96192230000003,0,29066.53,Winter,True,0.9173,great buy at a good deal i love this device. the support from the seller is also amazing. didn't even look like a refurbished device except the original items that would usually come with a new phone. i highly recommend.,1.0
ORD046651,ID0030947458,2019-07-01,Nickolson,"[('pearTV', 2), ('Toshika 750', 1), ('Olivia x460', 1)]",,67.75,-37.803268,144.9651635,5,,Winter,True,1.7492,one star i wasn't able to activate was looked,0.0
ORD019941,ID0387266357,2019-03-12,,"[('Toshika 750', 1), ('pearTV', 1)]",10630.0,79.02,-37.8103955,144.9556369,10,9646.02,Autumn,True,,five stars amazing phone and underated.,1.0
ORD143057,ID0163643086,2019-06-01,Nickolson,"[('iAssist Line', 2), ('Olivia x460', 2), ('Alcon 10', 1)]",,66.73,-37.8237924,144.97843799999995,25,,Winter,False,0.9723,i bought this for my mother and she is in love with it.she loves the guard dog feature.she says that it gives her a sense of security at night and when she leaves the house,1.0
ORD466283,ID0767585517,2019-12-24,Thompson,"[('Alcon 10', 2), ('Olivia x460', 1), ('iAssist Line', 1)]",21350.0,70.52,-37.8059472,144.94731330000005,15,18218.02,Summer,False,0.749,nice price great phone,1.0
ORD294073,ID6167440986,2019-08-02,Nickolson,"[('Olivia x460', 2), ('iStream', 2)]",2750.0,76.04,-37.8142098,144.9629982,10,2551.04,Winter,True,0.7552,four stars good bargain. would buy again.,1.0
ORD089078,ID0060305380,2019-03-12,Bakers,"[('Olivia x460', 1), ('Lucent 330S', 2), ('Toshika 750', 2)]",12325.0,82.48,-37.8009189,145.0073256,0,12407.48,Autumn,True,1.4671,5stars good cell.,1.0
ORD273845,ID0168398834,2019-02-23,Nickolson,"[('Alcon 10', 2), ('Thunder line', 1), ('pearTV', 2), ('Universe Note', 1)]",36150.0,95.42,-37.8122185,144.9608499,0,36245.42,Summer,True,1.0437,excellent this cellphone it's just like new. everything works very good!,1.0
ORD471846,ID0361229932,2019-12-30,Nickolson,"[('iStream', 2), ('Thunder line', 1)]",2480.0,105.79,-37.8003359,144.9749034,25,1965.79,Summer,True,2.0863,"don't pay 1000 for a band name phone works with t-mobile, lte sometimes drops. update 5 months in and love the phone, even bought one for my daughter and she love it better than her alcon 7. pros: cheap, good battery cons: ads, 90% t mobile coverage",1.0
ORD180569,ID0777743542,2019-08-30,Thompson,"[('Thunder line', 2), ('Candle Inferno', 1)]",4790.0,65.0,-37.805895,144.9559639,10,4376.0,Winter,True,1.0869,"doesn't work very well or at all. this does technically work with tmobile, but the service is terrible. it just keeps disconnecting and forget trying to talk to anyone on it. it would drop the call as soon as it was placed. we wanted to switch to the $3 monthly pay as you go, but this phone can't handle it.",0.0
ORD156584,ID6167254956,2019-06-17,Nickolson,"[('Toshika 750', 1), ('Candle Inferno', 2), ('pearTV', 2), ('Lucent 330S', 1)]",19030.0,,-37.8165829,144.9700231,5,18152.49,Winter,True,0.2278,"excellent! very happy! wonderful experience! product was just as promised! phone works great! hubs is happy, happy, happy! excellent customer service! would definitely recommend buying from them!",1.0
ORD438865,ID1450727124,2019-04-11,Nickolson,"[('Olivia x460', 2), ('pearTV', 2)]",15070.0,,-37.8238686,144.9838149,5,14400.49,Autumn,True,1.3848,"this a great tablet, my grandaughter uses the candle settings for her little girl who is in pre school",1.0
ORD034931,ID6138708862,2019-04-13,Bakers,"[('Candle Inferno', 1), ('iAssist Line', 1)]",2655.0,67.41,-37.8014312,144.9797686,15,2324.16,Autumn,False,1.6609,really good really good,1.0
ORD436306,ID0358732437,2019-04-30,Nickolson,"[('Toshika 750', 1), ('Universe Note', 1), ('iStream', 2), ('Olivia x460', 1)]",,66.66,-37.8191696,144.984714,25,,Autumn,False,1.3349,"this tablet is exactly what i was looking for to take on trips. the kids can watch their movies and videos, or i can read from my candle library. perfect size.",1.0
ORD218132,ID3218293539,2019-11-11,Thompson,"[('Lucent 330S', 1), ('Olivia x460', 1)]",2455.0,73.72,-37.8099268,144.944849,10,2283.22,Spring,False,0.3627,four stars very good battery life! front-facing camera could be better though...,1.0
ORD184828,ID0207093464,2019-08-20,Bakers,"[('pearTV', 2), ('Toshika 750', 1), ('Universe Note', 1), ('Thunder line', 2)]",24750.0,75.24,-37.8070205,145.0001939,25,18637.74,Winter,True,0.5479,"works with verizon! i really like this phone. came in tact, no scratches and fr looks like new. i have verizon and switching my sim card to this phone was easy peasy! love the phone! if you were questioning buying it, dont! just get it!",1.0
ORD316070,ID0634784746,2019-03-18,Thompson,"[('Candle Inferno', 2), ('iStream', 1), ('Toshika 750', 2)]",9650.0,78.93,-37.8145621,144.93822350000005,5,9246.43,Autumn,True,0.8058,xp at it's best! i always had xp phones. since the beginning! but this one is xp at it's best! brilliant screen resolution! and superb cameras! and the sound woof woof!,1.0
ORD149067,ID1463547085,2019-08-27,Bakers,"[('Universe Note', 2), ('Candle Inferno', 1), ('Lucent 330S', 1)]",8560.0,68.65,-37.8191748,145.00569009999995,15,7344.65,Winter,False,1.3747,"four stars phone works great, really quick shipping!",1.0
ORD104932,ID0628175343,2019-12-18,Thompson,"[('pearTV', 1), ('Alcon 10', 2), ('Candle Inferno', 1)]",24640.0,,-37.8129341,144.94833480000003,15,21014.01,Summer,True,0.1151,the battery is dead from the beginning! we could not even charge the battery but have to return the product including a case! what a troublesome experience!,0.0
ORD018426,ID4655086241,2019-10-04,,"[('iStream', 1), ('Thunder line', 1)]",2330.0,72.9,-37.8107635,144.9455767,10,2169.9,Spring,False,,three stars not bad but too slow,1.0
ORD458289,ID4315295106,2019-12-20,Bakers,"[('Olivia x460', 1), ('Candle Inferno', 1), ('Toshika 750', 1), ('iStream', 2)]",6275.0,71.67,-37.8159696,144.9915803,10,5719.17,Summer,False,0.7384,"should have done this a long time ago. cosmetically, the device was flawless. thus far, it operates flawlessly as well. i was nervous buying this device, but i’m glad i did. my carrier offered the same alcon with less memory for more money.",1.0
ORD018540,ID1994687835,2019-02-04,,"[('Olivia x460', 2), ('Universe Note', 2)]",9350.0,80.76,-37.7996368,144.9509081,25,7093.26,Summer,False,1.4899,great android phone exactly what i needed!,1.0
ORD091243,ID0643990753,2019-04-07,Bakers,"[('iStream', 1), ('Thunder line', 2), ('Olivia x460', 2), ('pearTV', 1)]",13270.0,,-37.8242717,144.9886927,15,11365.83,Autumn,True,1.69,a great refurbished alcon fantastic price! amazing quality on the phone! looks like it came straight out of the factory!,1.0
ORD346578,ID0282825751,2019-12-14,Thompson,"[('Olivia x460', 2), ('Alcon 10', 2)]",20350.0,78.94,-37.8018202,144.95327880000005,10,18393.94,Summer,False,1.3258,five stars my daughter loves it,1.0
ORD290413,ID3215191999,2019-08-09,Thompson,"[('iStream', 1), ('Thunder line', 1)]",2330.0,76.02,-37.8065273,144.9487655,15,2056.52,Winter,True,0.7002,great to play music throughout the house. great and easily fits in my decor of my home,1.0
ORD374848,ID0634777956,2019-04-17,Thompson,"[('Toshika 750', 2), ('Lucent 330S', 1), ('Olivia x460', 2), ('iStream', 2)]",12620.0,66.74,-37.8146711,144.93760319999996,0,12686.74,Autumn,False,0.8616,smart choice one of the best phones ever..,1.0
ORD071500,ID2174950795,2019-06-09,Thompson,"[('Toshika 750', 1), ('Candle Inferno', 2), ('Thunder line', 2)]",9540.0,59.48,-37.8155909,144.95264,25,7214.48,Winter,True,0.5878,just a heads up phone was not in as good of shape as i expected at this price point. the battery life has consistently gotten worse until the point it can no longer hold charge. i’ve contacted about a return and they have yet to offer any support,0.0
ORD263824,ID6167417950,2019-08-12,Nickolson,"[('iAssist Line', 1), ('Thunder line', 2), ('Lucent 330S', 2), ('iStream', 2)]",9345.0,64.65,-37.8141109,144.96326619999996,25,7073.4,Winter,False,0.7447,"works great i love my phone, i have had no problems with it",1.0
ORD410420,ID0310727778,2019-04-12,Thompson,"[('Candle Inferno', 2), ('Lucent 330S', 2)]",3320.0,67.66,-37.8115487,144.9361249,25,2557.66,Autumn,False,0.9706,excellent condition calls and emails an text,1.0
ORD341774,ID0777825195,2019-10-20,Thompson,"[('Lucent 330S', 2), ('Alcon 10', 2), ('Olivia x460', 1), ('Thunder line', 2)]",,105.92,-37.8040517,144.9581406,10,,Spring,True,1.3672,can't believe i waited so long to get a real e-reader. so easy to read from.,1.0
ORD146268,ID0245533066,2019-03-16,Nickolson,"[('Universe Note', 2), ('Toshika 750', 1), ('Olivia x460', 1), ('Thunder line', 1)]",14625.0,,-37.8120357,144.9668588,5,13973.33,Autumn,True,0.7676,nice product for the price. it does what we need it to do. easy to use and handy to have with you instead of a heavy laptop.,1.0
ORD382287,ID0529205069,2019-05-21,Thompson,"[('pearTV', 1), ('Toshika 750', 1), ('Universe Note', 1)]",14080.0,,-37.8233965,144.93557969999995,25,10628.14,Autumn,True,1.5639,phone dead after less than 5 months half way though my day the mobile connection no longer works. wifi works. but no cell service. tried doing a factory reset and all the usual troubleshooting steps. sim card works in another phone. toshika support is non-existent and the warranty is useless.,0.0
ORD484756,ID0247007089,2019-08-08,Nickolson,"[('Thunder line', 2), ('iStream', 1), ('pearTV', 2), ('Olivia x460', 1)]",18355.0,78.27,-37.8097324,144.967153,25,13844.52,Winter,True,1.0088,this product is really awesome for kids to play in all sorts.we can use a strong case and let kids play in it .,1.0
ORD167902,ID2383211198,2019-02-23,Nickolson,"[('Thunder line', 2), ('Alcon 10', 2)]",22260.0,96.37,-37.8095398,144.9637886,10,20130.37,Summer,True,1.1282,nice gradens,
ORD060415,ID0266737792,2019-04-15,Nickolson,"[('pearTV', 1), ('iStream', 2)]",6610.0,81.65,-37.8235366,144.9808725,25,5039.15,Autumn,True,1.1374,five stars looks real good,
ORD403054,ID0373657260,2019-08-18,Thompson,"[('Lucent 330S', 2), ('Thunder line', 2), ('Olivia x460', 1), ('iStream', 2)]",8345.0,80.76,-37.8113609,144.9300852,0,8425.76,Winter,True,1.5007,five stars just like new,1.0
ORD480157,ID6197211189,2019-04-14,,"[('iStream', 2), ('Alcon 10', 2), ('Thunder line', 1)]",20380.0,52.78,-37.8149648,144.92756630000005,10,18394.78,Autumn,False,1.734,refurbished junk the phone did not survive the first time it was dropped and now the screen is black. this is even with a case and and screen protector.,0.0
ORD118478,ID0582798760,2019-09-24,Nickolson,"[('Olivia x460', 1), ('iAssist Line', 2), ('iStream', 2)]",5975.0,89.43,-37.8234385,144.9792752,15,5168.18,Spring,True,1.0109,couldn't activate phone i was not able to activate the phone (the numbers i needed off of the back were missing).some numbers on the phone did not work. i had to pay for shipping to receive it and to ship it back. i was only refunded the amount i paid for the phone.,0.0
ORD343399,ID0054397028,2019-10-18,Thompson,"[('Candle Inferno', 1), ('iStream', 1), ('Thunder line', 1), ('Universe Note', 2)]",9660.0,102.52,-37.8024032,144.9476267,10,8796.52,Spring,True,1.1443,product ear piece i have received my order but i was amazed to discovered that the ear piece was missing. please i want to know the reason why the ear piece did not came with the xp lumia 900 because the description of the product says its a new product,1.0
ORD122099,ID0777778344,2019-12-31,Thompson,"[('Olivia x460', 2), ('iStream', 2), ('Universe Note', 2), ('pearTV', 1)]",15960.0,92.56,-37.80540300000001,144.95214130000005,10,14456.56,Summer,True,0.9241,it's ok. it's not the best one and not horrible. it takes forever to charge. it looses wifi signal when all other devices are perfect. it does have a super clear picture.,1.0
ORD240739,ID5668009838,2019-12-08,Bakers,"[('Alcon 10', 2), ('Candle Inferno', 2)]",18760.0,102.07,-37.8103201,145.0147918,25,14172.07,Summer,True,1.7206,i love the simple set up i love the fact that it has all the answers to most of the questions that i have i bought one for everybody in my family so we can all be like the jetsons,1.0
ORD042800,ID6167289289,2019-06-11,Nickolson,"[('Toshika 750', 2), ('iAssist Line', 1)]",10865.0,66.19,-37.8097466,144.9637581,15,9301.44,Winter,False,1.1089,"excellent device, good condition excellent phone",1.0
ORD007947,ID3518544268,2019-07-08,,"[('Thunder line', 1), ('Lucent 330S', 2), ('Universe Note', 2)]",11540.0,75.43,-37.803445,144.99141200000003,5,11038.43,Winter,True,0.8029,five stars love this purchase! looks and works perfect!,1.0
ORD081161,ID0356098768,2019-10-14,Bakers,"[('Universe Note', 2), ('Lucent 330S', 1), ('Olivia x460', 2), ('iStream', 2)]",10880.0,79.82,-37.8209454,144.99190430000004,25,8239.82,Spring,False,1.2535,great phone great camera and phone overall. however package did not come with headphones.,1.0
ORD460569,ID0202759186,2019-03-31,Thompson,"[('iAssist Line', 2), ('Alcon 10', 1)]",13400.0,80.88,-37.8083191,144.9363986,0,13480.88,Autumn,True,1.0562,love the whole phone love my phone,1.0
ORD104740,ID0301537545,2019-10-19,Thompson,"[('Olivia x460', 1), ('Alcon 10', 1), ('Universe Note', 1)]",13625.0,101.92,-37.8201771,144.9427589,25,10320.67,Spring,True,0.9173,"this is a great phone and good price this is a great phone and good price. the stylus could be a bit more sensitive, but i think that's on olivia's end. hope it lasts at least as long as my note 2 did!! i did download a different note program because the layout changed from note 2.",1.0
ORD408508,ID2755217883,2019-03-01,Bakers,"[('Toshika 750', 1), ('Thunder line', 2), ('Olivia x460', 1)]",9905.0,78.44,-37.8044379,144.9935677,25,7507.19,Autumn,True,0.6358,four stars good,1.0
ORD261405,ID0253027642,2019-06-12,Thompson,"[('Lucent 330S', 2), ('Alcon 10', 1)]",11410.0,53.7,-37.82444870000001,144.9471944,5,10893.2,Winter,False,1.3109,problems of factory the phone has a couple of months and started having problems with. manufactures and stopped working,0.0
ORD270365,ID6167417976,2019-11-29,Nickolson,"[('Alcon 10', 2), ('pearTV', 2)]",30520.0,85.5,-37.8121891,144.96979869999996,25,22975.5,Spring,True,0.7134,"mal teléfono no bloquea pantalla al hablar, tactil falla, y no tiene la velocidad acorde a sus gigas, pero como lo compre y lo trajeron a uruguay nada puedo hacer",0.0
ORD123289,ID1463620602,2019-02-20,Bakers,"[('Thunder line', 1), ('Candle Inferno', 1)]",2610.0,,-37.8174936,145.00401730000004,15,2281.31,Summer,False,1.1373,incorrect advertisement phone was not unlocked as advertised,0.0
ORD423288,ID0282825839,2019-10-07,Thompson,"[('Olivia x460', 1), ('iAssist Line', 1), ('Lucent 330S', 1)]",4680.0,101.39,-37.8032848,144.9512167,10,4313.39,Spring,True,1.1069,xiaomi redmi note 6 pro factory unlocked this phone is awesome! 5 stars all around. it will work if your service uses a sim card. camera is wow!!! i haven't had a great camera since my toshika experia zr (mint). i highly recommend it.😁,1.0
ORD198481,ID0202772778,2019-09-27,Thompson,"[('Lucent 330S', 2), ('pearTV', 1), ('Olivia x460', 1)]",9995.0,88.34,-37.8083333,144.9351746,5,9583.59,Spring,True,1.1522,it gives me second thoughts of buying another phone on digico battery burns out fast. gets hot,0.0
ORD039195,ID0576834101,2019-03-07,,"[('Olivia x460', 2), ('Toshika 750', 1)]",6770.0,81.62,-37.8170755,144.9832608,15,5836.12,Autumn,True,,works with mint buy this and don't pay 750$ for the us version i have mint sim card and it works well,1.0
ORD082786,ID0781154913,2019-12-20,Thompson,"[('pearTV', 1), ('Lucent 330S', 1)]",7540.0,77.93,-37.8016016,144.9428166,25,5732.93,Summer,False,1.288,phone call quality is superb phone is great!,1.0
ORD346184,ID0588236713,2019-04-04,Nickolson,"[('iAssist Line', 1), ('iStream', 1)]",2375.0,79.6,-37.8111532,144.97339240000005,10,2217.1,Autumn,True,0.8946,olivia universe s 4 i like the olivia phones. i had 2 before purchasing this one. loved my 2. so far this one is good. lots of new features. still learning how to use it. so far tho im glad i got it.,1.0
ORD108638,ID0702456085,2019-06-13,Thompson,"[('Alcon 10', 1), ('iStream', 2)]",9250.0,76.98,-37.80490820000001,144.9468264,15,7939.48,Winter,True,0.8646,five stars phone is very good !!!,1.0
ORD062055,ID2187986724,2019-01-02,Nickolson,"[('Thunder line', 1), ('Candle Inferno', 1), ('Olivia x460', 1)]",3835.0,94.57,-37.8115911,144.97248480000005,25,2970.82,Summer,True,0.8212,came as advertised and works great delivered in great condition. i wanted to stay with the s6 size since i like to carry it in my pocket and my battery was no longer holding a charge. seamless transition of apps and settings using olivia cloud. i'm very happy with this purchase,1.0
ORD400687,ID0775942446,2019-02-06,Thompson,"[('iAssist Line', 1), ('Alcon 10', 1)]",11175.0,82.02,-37.8064775,144.9614999,10,10139.52,Summer,False,1.4444,my dad loved it my dad loved it. he is not very good with technology and this one is super easy to use,1.0
ORD422942,ID2347234661,2019-08-16,Thompson,"[('Universe Note', 1), ('Toshika 750', 2)]",12090.0,65.15,-37.8124804,144.93620790000003,5,11550.65,Winter,False,0.9554,"perfect!! i, like alot of people were sceptical about a ""refurbished phone"" but these people made me a believer! phone is like brand new and i love it! very happy with the battery life as well!",
ORD028472,ID0664380199,2019-01-06,Nickolson,"[('Lucent 330S', 2), ('Alcon 10', 2), ('iStream', 2)]",20660.0,,-37.8195648,144.969116,15,17611.38,Summer,False,0.1145,very disappointed the back side of the phone has many scratches and not clean at all very disappointed,0.0
ORD442208,ID3281126656,2019-10-07,Thompson,"[('pearTV', 1), ('Candle Inferno', 2)]",7170.0,65.95,-37.8048939,144.9615325,0,7235.95,Spring,False,1.5388,stuck pixel developed a stuck pixel after a few days.,0.0
